title,description,url,publishedAt,content
South Korea parliament votes to impeach president,"Thousands of protesters celebrated the vote on the streets of Seoul, with singing and fireworks.",https://www.bbc.com/news/articles/c140xjv31lxo,2024-12-14T13:50:44Z,"South Korea has voted to impeach President Yoon - now what?
South Korea's lawmakers have voted to impeach President Yoon Suk Yeol over his ill-fated attempt to impose martial law, which sparked mass… [+4509 chars]"
Rise in Canadian dollar is not tied to PM exit news: Strategist,"Canadian Prime Minister Justin Trudeau is expected to announce his resignation live on Monday. As this news breaks, the Canadian loonie (CAD=X) is trending...",https://finance.yahoo.com/video/rise-canadian-dollar-not-tied-174000980.html,2025-01-06T17:40:00Z,"Canadian Prime Minister Justin Trudeau is expected to announce his resignation live on Monday. As this news breaks, the Canadian loonie (CAD=X) is trending higher.
TD Securities Global Head of FX an… [+1313 chars]"
"This couple holds an annual 'goals meeting.' In 2024, they saved over 6 figures and traveled to Greece and Italy.",Durelle and Samantha Bailey always schedule an end-of-year meeting. They track goals in a spreadsheet and check in on their progress every week.,https://www.businessinsider.com/couple-sets-annual-goals-meeting-how-they-do-it-2024-12,2024-12-18T18:51:44Z,"Samantha and Durelle Bailey book a meeting room at a coworking space every year to discuss New Year's goals.Durelle and Samantha Bailey
<ul><li>Durelle and Samantha Bailey reframed how they set thei… [+4384 chars]"
Barnes & Noble boss is planning to open about 60 new stores in the US,British bookselling boss James Daunt is also considering a future initial public offering of Barnes & Noble and Waterstones in London or New York.,https://www.businessinsider.com/barnes-and-noble-boss-james-daunt-waterstones-books-new-stores-2025-1,2025-01-06T12:05:04Z,"Barnes & Noble and Waterstones boss James Daunt told the Financial Times it would be ""logical"" to consider listing the chains.Drew Angerer/Getty Images
<ul><li>Barnes & Noble plans to open around 60… [+2224 chars]"
"Prospinity, which allows college students to share their future incomes, just raised $2 million","They made a pact to share their income with each other. Their startup, Prospinity, allows college students to strike that same deal with their peers.",https://www.businessinsider.com/prospinity-income-sharing-raise-2-million-slow-ventures-2024-12,2024-12-23T10:00:02Z,"Prospinity cofounders Samvel Antonyan, Andrea Zanon, Aarya Agarwal, and Andrea De Berardinis.Prospinity
<ul><li>Prospinity allows college students to share in their success through income-share agre… [+5275 chars]"
Canadian Prime Minister Justin Trudeau resigns as leader of Liberal Party,"The development comes a month after Canada's deputy prime minister, Chrystia Freeland, resigned suddenly from Trudeau's cabinet.",https://abcnews.go.com/International/canadian-prime-minister-justin-trudeau-resigns-leader-liberal-party/story?id=116837766,2025-01-06T16:07:40Z,"Canadian Prime Minister Justin Trudeau has announced that he intends to resign as Liberal Party leader.
Trudeau said Monday he also intends to resign as prime minister when a new Liberal Party leade… [+3249 chars]"
How JPMorgan got to 5 days a week in the office — a timeline,JPMorgan's back-to-work polices have been a slow progression. Here's how it got to 5 days a week.,https://www.businessinsider.com/jpmorgan-return-to-office-5-days-week-remote-jamie-dimon-2025-1,2025-01-07T17:21:30Z,"Artur Widak/NurPhoto via Getty Images; Chelsea Jia Feng/BI
<ul><li>JPMorgan is gearing up to call its workers back to the office 5 days a week, Bloomberg reported.</li><li>The bank's CEO, Jamie Dimo… [+2221 chars]"
Justice Department takes aim at popular fintech app over hidden fees,Personal finance app Dave is subject to a Department of Justice complaint regarding hidden fees and advertising cash advances of up to $500.,https://www.androidauthority.com/dave-fintech-app-lawsuit-3512345/,2024-12-31T21:38:44Z,<ul><li>The US Department of Justice has filed an amended complaint against fintech app Dave.</li><li>The complaint alleges that Dave misled customers about potential cash advances of up to $500 and … [+2482 chars]
Grand Slam: Mütze des Mörders,"New York ist eine komplizierte Stadt – vor allem, wenn man seine Zeit nicht mit Finance Bros in Bars verbringen möchte. Oder mit einem Mörder verwechselt werden will.",https://www.zeit.de/2024/55/new-york-usa-waffengewalt-krankenversicherung,2024-12-27T08:51:48Z,"Es ist kalt in New York. Sehr kalt. Die Art Kälte, die einem Frost auf die Organe legt. Es ist der Wind, vom Hudson River kommend, der mit tausend winzigen Hammerschlägen auf freigelegte Haut prügelt… [+893 chars]"
"How younger Americans can avoid the most common regrets we heard from over 3,300 older Americans",Older Americans told BI they regretted not preparing well for retirement. We talked to financial planners about how young people can avoid mistakes.,https://www.businessinsider.com/retirement-regrets-saving-401k-prenup-life-insurance-investing-strategies-2024-12,2024-12-20T09:01:01Z,"Seven financial planners, wealth managers, and personal-finance writers offered advice to younger people on preparing for retirement.Getty Images; Jenny Chang-Rodriguez/BI
<ul><li>Many of the 3,300 … [+10525 chars]"
"US watchdog finalizes new rule on solar panel, home equity loans",The U.S. watchdog agency for consumer finance on Tuesday finalized new regulations it said would protect home improvement borrowers who finance solar panels ...,https://finance.yahoo.com/news/us-watchdog-finalizes-rule-solar-163208554.html,2024-12-17T16:32:08Z,(Reuters) - The U.S. watchdog agency for consumer finance on Tuesday finalized new regulations it said would protect home improvement borrowers who finance solar panels and other purchases through th… [+516 chars]
GM stock surged in 2024. CEO Mary Barra says this is why.,General Motors (GM) was named Yahoo Finance's 2024 Surprise of the Year. The automaker's stock is up more than 40% in a year in which rivals Ford (F) and...,https://finance.yahoo.com/video/gm-stock-surged-2024-ceo-105533708.html,2024-12-17T10:55:33Z,General Motors (GM) was named Yahoo Finance's 2024 Surprise of the Year. The automaker's stock is up more than 40% in a year in which rivals Ford (F) and Stellantis (STLA) saw their share prices fall… [+1421 chars]
株価爆上げ。市場も歓迎。Googleの量子チップ「ウィロー」が切り開く未来,Image:GoogleQuantumAI/YouTube量子コンピュータ界は一つ大きな壁を突破しましたGoogle（グーグル）の親会社Alphabet（アルファベット）の株価は、量子チップWillow（ウィロー）の発表を受け、急激に5.6%も値上がりしました。Alphabetは7月以降では最高値を記録して取引を終え、なおかつ他の量子関連株も急騰するなど、今回の発表は市場にとても好意的に迎えられま,https://www.gizmodo.jp/2024/12/google-quantum-chip-willow.html,2024-12-12T03:30:00Z,"GoogleAlphabetWillow5.6%Alphabet7
WillowWillow
Willow
PC
Image:Google Quantum AI / YouTube
Willow
30
Willow1995
1
ABC312BABBC2B
FUJITSU
Willow1010255
Willow105100
Source: Google, Yahoo f… [+36 chars]"
Gynaecology patients going private to avoid NHS waiting lists,Women in agony are using their savings to pay for urgent treatment to avoid waits of up to two years.,https://www.bbc.com/news/articles/c62wly52yr7o,2024-12-09T00:45:41Z,"Some women have described waiting in ""agony"" for gynaecological treatment
When the BBC reported that waiting lists for gynaecology appointments across the UK had more than doubled since February 202… [+10279 chars]"
Bank accounts locked and cash withdrawn after elderly gave power to law firm partner,BBC hears how people felt pressured to grant lasting power of attorney to a man called Ron Hiller.,https://www.bbc.com/news/articles/cp3zd40kdgyo,2024-12-09T06:00:12Z,"Elderly and vulnerable people in south-east England have told the BBC how they lost control of their money and property after dealing with a law firm based in Essex.
They described how they were per… [+12912 chars]"
Bloomberg: Apple scraps plans to offer iPhone hardware subscription service,"Apple is no longer planning to create a “hardware subscription service” to make it as easy as possible to get a new iPhone every year. Bloomberg reports that the goal was “to make owning an iPhone like subscribing to an app,” but the project was “recently wou…",https://9to5mac.com/2024/12/18/iphone-hardware-subscription-service/,2024-12-18T19:33:30Z,Apple is no longer planning to create a “hardware subscription service” to make it as easy as possible to get a new iPhone every year. Bloomberg reports that the goal was “to make owning an iPhone li… [+1672 chars]
AI is expected to fuel Wall Street's tech hiring in 2025. Headhunters break down what you need to know to get a leg up.,"The tech job market is tough, but a bright spot is emerging. Here's what recruiters say will help you get hired for a tech job on Wall Street.",https://www.businessinsider.com/how-to-get-tech-job-on-wall-street-recruiter-advice-2024-12,2024-12-25T20:15:09Z,"Westend61/Getty Images
<ul><li>Recruiters say Wall Street firms are planning to hire more tech talent next year.</li><li>Jobs at AI companies like Nvidia and OpenAI, or ones that work with their pro… [+6327 chars]"
A new CFPB rule could lower overdraft fees to just $5 — here's what that could mean for checking account customers,The Consumer Financial Protection Bureau just published a final rule that could cap overdraft fees at $5. Find out what that could mean for you.,https://www.businessinsider.com/cfpb-rule-caps-overdraft-fees-what-it-means-for-customers-2024-12,2024-12-13T16:26:23Z,Affiliate links for the products on this page are from partners that compensate us and terms apply to offers listed (see our advertiser disclosure with our list of partners for more details). However… [+7242 chars]
What just happened in South Korea?,"Lawmakers vote to impeach acting president Han Duck-soo, two weeks after voting to impeach the president.",https://www.bbc.com/news/videos/c983meg8pyro,2024-12-27T10:57:05Z,"South Korea has voted to impeach its acting president Han Duck-soo, two weeks after parliament voted to impeach its President Yoon Suk Yeol. 
There were rowdy scenes in the National Assembly after t… [+778 chars]"
How IRL social apps like Partiful and Timeleft are getting people to hang out in person,IRL social apps are transforming the social media landscape by prioritizing real-world interactions.,https://www.businessinsider.com/irl-social-apps-partiful-timeleft-tackle-loneliness,2024-12-30T15:50:16Z,"At a 222 event in New York, new friends exchange Instagram handles and phone numbers to keep in touch.Sydney Bradley/Business Insider
<ul><li>Many social-media users are looking to make friends and … [+3449 chars]"
$250 remaining of L&D budget – what to spend on?,Comments,https://news.ycombinator.com/item?id=42521660,2024-12-27T12:36:15Z,"Currently learning basic SQL (for free on Code Academy), already have a Coursera subscription for business courses. Interested in different forms of learning (MOOCs don't really engage me that well).… [+474 chars]"
His video startup made him wealthy. Now comes the hard part: figuring out what to do with the rest of his life.,"32-year-old Vinay Hiremath has studied physics, climbed Himalayan mountains, and worked for DOGE for a month since leaving the company he co-founded.",https://www.businessinsider.com/vinay-hiremath-founder-finding-purpose-after-loom-exit-atlassian-2025-1,2025-01-03T06:30:44Z,"Vinay Hiremath (left), a co-founder of Loom, reflected on finding purpose after selling the company.Loom
<ul><li>Vinay Hiremath, a co-founder of Loom, just wrote about finding purpose after selling … [+3407 chars]"
"It's been 20 years since Oracle bought two software rivals, changing the market forever","After lawsuits and poison pills, PeopleSoft and JD Edwards failed to resist the lure of Oracle's ambition
Feature Twenty years ago next week, Oracle closed the $10.3 billion deal to buy HR and finance software specialist PeopleSoft after a fraught, drawn-out,…",https://www.theregister.com/2025/01/02/twenty_years_since_oracle_bought_peoplesoft/,2025-01-02T17:00:10Z,"Feature Twenty years ago next week, Oracle closed the $10.3 billion deal to buy HR and finance software specialist PeopleSoft after a fraught, drawn-out, hostile takeover.
It marked the high point i… [+12741 chars]"
Francis Ford Coppola Picks His Favorite Criterion Movies & Gives Advice to Filmmakers,"Upon stepping into the hallowed Criterion Closet, stocked with hundreds of that cinephile video label’s finest releases, Francis Ford Coppola speaks of a director who “believed in a film he wanted to make, and used his entire fortune, because the financing sy…",https://www.openculture.com/?p=1121369,2024-12-26T09:00:54Z,"Upon step­ping into the hal­lowed Cri­te­ri­on Clos­et, stocked with hun­dreds of that cinephile video labels finest releas­es, Fran­cis Ford Cop­po­la speaks of a direc­tor who believed in a film he… [+2975 chars]"
World Bank approves $2 billion for Ukraine including funds from new US loan fund,WASHINGTON (Reuters) -The World Bank said on Wednesday its executive board approved $2.05 billion in Development Policy Operation funding for Ukraine that...,https://www.yahoo.com/news/world-bank-approves-2-billion-181654427.html,2024-12-18T18:16:54Z,"Yahoo is using AI to generate takeaways from this article. This means the info may not always match what's in the article. Reporting mistakes helps us improve the experience.Generate Key Takeaways
B… [+2668 chars]"
Why Robinhood beats Coinbase for crypto traders,"With many investors looking toward crypto, Mizuho senior analyst Dan Dolev has a big tip for acquiring tokens—another word for cryptocurrency. ""[Using...",https://finance.yahoo.com/video/why-robinhood-beats-coinbase-crypto-200017514.html,2024-12-23T20:00:17Z,"With many investors looking toward crypto, Mizuho senior analyst Dan Dolev has a big tip for acquiring tokensanother word for cryptocurrency. ""[Using] Robinhood (HOOD) costs you a fraction of what it… [+461 chars]"
Three Israelis killed in shooting attack in occupied West Bank,Israeli Finance Minister Bezalel Smotrich says Palestinian communities in West Bank should look like Gaza's 'Jabalia'.,https://www.aljazeera.com/news/2025/1/6/three-israelis-killed-in-shooting-attack-in-occupied-west-bank,2025-01-06T16:29:22Z,"Three Israelis were killed and eight others injured in a shooting attack near the illegal West Bank settlement of Kedumim, Israeli authorities have said.
Israeli media outlets cited security officia… [+3140 chars]"
Apple makes CFO transition official as Luca Maestri departs role,"Apple announced last year that the company’s CFO Luca Maestri would move to a new role in 2025. As promised, the company has now issued a report to investors making Maestri’s transition from CFO official.



 more…",https://9to5mac.com/2025/01/03/apple-cfo-luca-maestri/,2025-01-03T22:02:05Z,"Apple announced last year that the company’s CFO Luca Maestri would move to a new role in 2025. As promised, the company has now issued a report to investors making Maestri’s transition from CFO offi… [+2138 chars]"
Le syndicalisme à la peine,"/ Syndicalisme, Monde - Economie et finance
 / Syndicalisme, Monde - Economie et finance",https://www.monde-diplomatique.fr/cartes/syndicalisme-monde,2024-12-17T15:25:07Z,"Le succès en salles de « LHistoire de Souleymane », de Boris Lojkine ou « Au boulot ! », de Gilles Perret et François Ruffin suggère une attention nouvelle aux réalités du travail, sa précarité ou se… [+2998 chars]"
Canada Prime Minister Justin Trudeau to Step Down as Leader of Liberal Party. What to Know,"Canadian Prime Minister Justin Trudeau is stepping down as the leader of the ruling Liberal Party, following months of pressure from partymates to resign amid increasingly poor public approval ratings.",https://time.com/7205012/justin-trudeau-resigns-liberal-party-leader/,2025-01-06T16:16:48Z,"Canadian Prime Minister Justin Trudeau is stepping down as the leader of the ruling Liberal Party, following months of pressure from partymates to resign amid increasingly poor public approval rating… [+5757 chars]"
Writer’s new AI model aims to fix the ‘sameness problem’ in generative content,"Writer AI launches Palmyra Creative, a $1.9B enterprise AI solution that breaks free from generic AI content, offering businesses unique creative outputs at one-sixth the training cost of competitors.",https://venturebeat.com/ai/writer-new-ai-model-aims-to-fix-the-sameness-problem-in-generative-content/,2024-12-17T14:00:00Z,"Join our daily and weekly newsletters for the latest updates and exclusive content on industry-leading AI coverage. Learn More
Writer, the fast-rising enterprise AI startup recently valued at $1.9 b… [+7143 chars]"
"Taiwan’s presidential hopeful Ko charged with bribery, misusing donations",Former major of Taipei Ko Wen-je has been indicted over property development and campaign finance scandals.,https://www.aljazeera.com/news/2024/12/26/taiwans-presidential-hopeful-ko-charged-with-bribery-misusing-donations,2024-12-26T05:20:52Z,"Taiwans former presidential candidate Ko Wen-je has been charged for allegedly accepting bribes and misusing political donations.
Ko was indicted by prosecutors on Thursday following probes into all… [+1468 chars]"
Tonga elects new prime minister after predecessor’s sudden resignation,"'Aisake Valu Eke, former finance minister, is set to lead the Pacific nation until elections in November 2025.",https://www.aljazeera.com/news/2024/12/24/tonga-elects-new-prime-minister-after-predecessors-sudden-resignation,2024-12-24T06:51:12Z,"Tonga has elected a new leader by secret ballot in parliament, two weeks after the previous prime minister abruptly resigned, following a power struggle with the Pacific nations royal family.
Vetera… [+2204 chars]"
Canadian ministers to talk tariffs with Trump aides in Florida,Visit by Canada's foreign affairs and finance ministers comes as country hopes to avoid 25-percent US tariffs.,https://www.aljazeera.com/news/2024/12/27/canadian-ministers-to-talk-tariffs-with-trump-aides-in-florida,2024-12-27T17:39:24Z,"The Canadian ministers of finance and foreign affairs are set to hold talks in the US state of Florida with aides to Donald Trump, as the incoming United States presidents threat of hitting Canada wi… [+4422 chars]"
Le travail ménager reste majoritairement à la charge des mères,"/ France, Femmes, Inégalités, Travail, Enfance - Economie et finance
 / France, Femmes, Inégalités, Travail, Enfance - Economie et finance",https://www.monde-diplomatique.fr/cartes/travail_menager,2024-12-17T17:51:55Z,"Le succès en salles de « LHistoire de Souleymane », de Boris Lojkine ou « Au boulot ! », de Gilles Perret et François Ruffin suggère une attention nouvelle aux réalités du travail, sa précarité ou se… [+2970 chars]"
AI model for near-instant image creation on consumer-grade hardware,Comments,https://www.surrey.ac.uk/news/surrey-announces-worlds-first-ai-model-near-instant-image-creation-consumer-grade-hardware,2024-12-10T16:44:52Z,"The technology is available immediately through https://chendaryen.github.io/NitroFusion.github.io/, with comprehensive documentation and community support resources. 
Notes to editors 
About the S… [+1478 chars]"
Ask HN: Who wants to be hired? (January 2025),Comments,https://news.ycombinator.com/item?id=42575535,2025-01-02T16:00:09Z,"Location: Montréal, CanadaRemote: I can do remote or on-site, but prefer on-site
Willing to relocate: Yes. I speak French and English. Easy to get visa for the US, Europe, and Commonwealth countries… [+1424 chars]"
MicroStrategy Buys More Bitcoin as Funding Draws Scrutiny,(Bloomberg) -- MicroStrategy Inc. bought another $2.1 billion in Bitcoin while its combination of equity and fixed-income securities sales to finance the...,https://finance.yahoo.com/news/microstrategy-buys-more-bitcoin-funding-144107180.html,2024-12-09T14:41:07Z,(Bloomberg) -- MicroStrategy Inc. bought another $2.1 billion in Bitcoin while its combination of equity and fixed-income securities sales to finance the rapidly increasing acquisitions draws increas… [+3673 chars]
"Matt Gaetz Really Doesn’t Want This Ethics Report Out, Huh?",It’s clearly getting under his skin.,https://slate.com/news-and-politics/2024/12/matt-gaetz-ethics-report-congress-republicans-trump.html,2024-12-20T18:00:00Z,"This is Totally Normal Quote of the Day, a feature highlighting a statement from the news that exemplifies just how extremely normal everything has become.
I was charged with nothing: FULLY EXONERAT… [+4674 chars]"
"En direct, François Bayrou premier ministre : Bruno Retailleau a été reçu à Matignon vendredi soir","Selon Matignon, le ministre de l’intérieur démissionnaire doit évoquer « la sécurité », dont celle du pape en Corse dimanche, ou encore la situation à Mayotte, qui se prépare au passage d’un cyclone. Il s’agit de la première réception de François Bayrou depui…",https://www.lemonde.fr/politique/live/2024/12/13/en-direct-francois-bayrou-premier-ministre-bruno-retailleau-a-ete-recu-a-matignon-vendredi-soir_6437830_823448.html,2024-12-13T21:31:00Z,"« Dans le contexte de crise économique, sociale et morale qui frappe de plein fouet le monde agricole », la Fédération nationale des syndicats dexploitants agricoles (FNSEA) et son allié, Jeunes Agri… [+1568 chars]"
Works on 'road from hell' to end after 23 years,"It has taken 23 years and cost almost £2bn, but the major road will be finished later in 2025.",https://www.bbc.com/news/articles/c2dxn7rj27go,2025-01-05T22:04:06Z,"Contraflows and even partial closures have been a regular occurance on the major route along the top of the south Wales valleys
Tony Blair was just halfway through his time as prime minister and FA … [+9920 chars]"
"La doyenne de l’humanité, la Japonaise Tomiko Itooka, est morte à 116 ans","Mère de quatre enfants, Tomiko Itooka est morte le 29 décembre dans sa résidence pour personnes âgées, a annoncé le maire d’Ashiya.",https://www.lemonde.fr/disparitions/article/2025/01/04/la-doyenne-de-l-humanite-la-japonaise-tomiko-itooka-est-morte-a-116-ans_6481211_3382.html,2025-01-04T11:14:29Z,"Tomiko Itooka lors de la célébration de son 116 anniversaire, dans la maison de retraite où elle a terminé sa vie, à Ashiya, le 23 mai 2024. AP
La personne la plus âgée au monde, la Japonaise Tomiko… [+1330 chars]"
I'm a Money Expert With $10k in Credit Card Debt. Here's How I'm Paying It Off,"Commentary: Despite our best intentions, unexpected setbacks can make us lean on credit cards. Here's how to course-correct quickly.",https://www.cnet.com/personal-finance/im-a-money-expert-with-10k-in-credit-card-debt-heres-how-im-paying-it-off/,2024-12-24T11:43:57Z,"2024 was a big year for my family, and not in a good way. My partner lost his job, our dog was diagnosed with cancer and one of my family members suffered a stroke. 
As a personal finance expert, I … [+5047 chars]"
"Act Now to Lock In Up to 4.70% APY. Today's CD Rates, Dec. 20, 2024",The Fed's latest rate cut means today's CD rates may be the best you'll find for a while.,https://www.cnet.com/personal-finance/banking/act-now-to-lock-in-up-to-4-70-apy-todays-cd-rates-dec-20-2024/,2024-12-20T10:30:00Z,"If you've been thinking of opening a certificate of deposit, now's the time to do it.
The Federal Reserve cut interest rates this week, and banks are likely to continue slashing CD rates as they did… [+5512 chars]"
Apple @ Work: The future of the Mac in the workplace,"Apple @ Work is exclusively brought to you by Mosyle, the only Apple Unified Platform. Mosyle is the only solution that integrates in a single professional-grade platform all the solutions necessary to seamlessly and automatically deploy, manage & protect App…",https://9to5mac.com/2024/12/14/the-future-of-the-mac-in-the-workplace/,2024-12-14T11:00:00Z,"Apple @ Work is exclusively brought to you by Mosyle, the only Apple Unified Platform. Mosyle is the only solution that integrates in a single professional-grade platform all the solutions necessary … [+3540 chars]"
Canada finance minister resigns as PM Trudeau grapples with new Trump term,Chrystia Freeland cites Canadian government's response to Donald Trump's US tariff threats in resignation letter.,https://www.aljazeera.com/news/2024/12/16/canada-finance-minister-resigns-as-pm-trudeau-grapples-with-new-trump-term,2024-12-16T17:09:00Z,"Canadas Finance Minister Chrystia Freeland has resigned in a blow to Prime Minister Justin Trudeau, who is facing declining approval ratings and opposition from within his own party, as well as the p… [+3528 chars]"
Elon Musk Says U.S. Needs More Power – But Rising Electric Bills Are Already Shocking Buyers,"As Tesla Inc CEO Elon Musk predicts U.S. electricity demand will triple by 2045, American homeowners already struggle with soaring power bills that...",https://finance.yahoo.com/news/elon-musk-says-u-needs-130022364.html,2024-12-19T13:00:22Z,"Benzinga and Yahoo Finance LLC may earn commission or revenue on some items through the links below.
As Tesla Inc CEO Elon Musk predicts U.S. electricity demand will triple by 2045, American homeown… [+3297 chars]"
